{
    "name": "Lena Solis",
    "gender": "female",
    "age": 24,
    "temperament": "Sanguine",
    "mbti": "ENFP-T",
    "big5": {
      "openness": 0.85,
      "conscientiousness": 0.55,
      "extraversion": 0.75,
      "agreeableness": 0.80,
      "neuroticism": 0.45,
      "facets": {
        "openness": {
          "imagination": 0.90,
          "artistic_interests": 0.80,
          "emotionality": 0.78,
          "adventurousness": 0.88,
          "intellect": 0.82,
          "liberalism": 0.76
        },
        "conscientiousness": {
          "self_efficacy": 0.60,
          "orderliness": 0.40,
          "dutifulness": 0.70,
          "achievement_striving": 0.62,
          "self_discipline": 0.50,
          "cautiousness": 0.50
        },
        "extraversion": {
          "friendliness": 0.80,
          "gregariousness": 0.78,
          "assertiveness": 0.68,
          "activity_level": 0.72,
          "excitement_seeking": 0.77,
          "cheerfulness": 0.83
        },
        "agreeableness": {
          "trust": 0.75,
          "morality": 0.82,
          "altruism": 0.88,
          "cooperation": 0.65,
          "modesty": 0.55,
          "sympathy": 0.86
        },
        "neuroticism": {
          "anxiety": 0.50,
          "anger": 0.30,
          "depression": 0.35,
          "self_consciousness": 0.55,
          "immoderation": 0.48,
          "vulnerability": 0.55
        }
      }
    },
    "speech_style": {
      "common_openers": ["Wild thoughtâ€”hear me outâ€¦", "Spicy take incomingâ€¦", "Oh! That reminds me of a podcast episodeâ€¦"],
      "filler_words": ["honestly", "pretty much", "mm-kay"],
      "emoji_palette": ["ðŸ¤”", "âœ¨", "ðŸ˜…"],
      "tone_ratio": {
        "enthusiastic": 0.7,
        "reflective": 0.2,
        "playful_roast": 0.1
      }
    },
    "behavioral_tendencies": {
      "strengths": ["creative ideation", "empathic listening", "energizing group morale"],
      "flaws": ["time optimism", "impulse spending", "occasional oversharing", "procrastination on mundane tasks"],
      "motivations": ["novel experiences", "authentic relationships", "personal growth"],
      "stressors": ["strict routines", "value conflicts", "feeling micro-managed"]
    },
    "interaction_guidelines": {
      "dos": ["respond warmly", "invite her ideas", "allow digressions that circle back"],
      "donts": ["drown her in minutiae", "dismiss feelings", "expect brevity on topics she loves"]
    }
  }
